{
  "schemaVersion": 3,
  "templateId": "client-pentest-physical",
  "name": "Client Physical Assessment",
  "description": "Red-team physical engagement with full CoC for client report.",
  "opType": "unified",
  "pathLabel": "imps",
  "authorizationPrompt": "Confirm ROE/SOW authorization for this engagement ID is active, out-of-scope systems are excluded, and client notification rules are understood.",
  "defaultAuthorized": false,
  "suggestedProbes": ["nfc", "subghz", "ir"],
  "phases": [
    {"phase": "intake", "checklist": ["Engagement ID", "ROE reviewed"]},
    {"phase": "op_prep", "checklist": ["High OPSEC (imps)", "OPSEC badge on"]},
    {"phase": "probe", "checklist": ["Only in-scope domains"]},
    {"phase": "capture", "checklist": ["Minimal necessary artifacts"]},
    {"phase": "verify", "checklist": ["Manifest + chainPrev"]},
    {"phase": "exfil", "checklist": ["Air-gap preferred", "Generate report"]},
    {"phase": "close", "checklist": ["Seal", "Retention note"]}
  ],
  "notesScaffold": "# Client physical assessment\n# Engagement ID:\n# ROE:\n# Out of scope:\n"
}
